{
 "category": "Verbs with Derivatives",
 "definition": "to follow",
 "headword": "اِتَّبَعَ / تُبَّع",
 "id": "5d89e690256d",
 "meaning": "to follow",
 "notes": [],
 "root": "ت ب ع",
 "root_translit": "t-b-ayn",
 "section": "verb",
 "senses": [
  {
   "ar": "اِتَّبَعَ",
   "count": 172,
   "gloss": "to follow",
   "n": 1,
   "translit": "ittaba'a"
  },
  {
   "ar": "تُبَّع",
   "count": 2,
   "gloss": "Tubba', title of ancient kings of Yemen who followed each other in succession",
   "n": 2,
   "translit": "Tubba'"
  }
 ],
 "source_keys": [
  "v047"
 ],
 "tags": [
  "verb",
  "verbs_with_derivatives"
 ],
 "total_uses": 174,
 "translit": "ittaba'a",
 "usage": [
  {
   "examples": [
    {
     "ar": "إِذْ تَبَرَّأَ ٱلَّذِينَ ٱتُّبِعُوا۟ مِنَ ٱلَّذِينَ ٱتَّبَعُوا۟ وَرَأَوُا۟ ٱلْعَذَابَ وَتَقَطَّعَتْ بِهِمُ ٱلْأَسْبَابُ",
     "en": "[And they should consider that] when those who have been followed disassociate themselves from those who followed [them], and they [all] see the punishment, and cut off from them are the ties [of relationship],",
     "ref": "2:166"
    },
    {
     "ar": "قُل لَّآ أَقُولُ لَكُمْ عِندِى خَزَآئِنُ ٱللَّهِ وَلَآ أَعْلَمُ ٱلْغَيْبَ وَلَآ أَقُولُ لَكُمْ إِنِّى مَلَكٌ ۖ إِنْ أَتَّبِعُ إِلَّا مَا يُوحَىٰٓ إِلَىَّ ۚ قُلْ هَلْ يَسْتَوِى ٱلْأَعْمَىٰ وَٱلْبَصِيرُ ۚ أَفَلَا تَتَفَكَّرُونَ",
     "en": "Say, [O Muhammad], \"I do not tell you that I have the depositories [containing the provision] of Allah or that I know the unseen, nor do I tell you that I am an angel. I only follow what is revealed to me.\" Say, \"Is the blind equivalent to the seeing? Then will you not give thought?\"",
     "ref": "6:50"
    },
    {
     "ar": "ثُمَّ جَعَلْنَٰكَ عَلَىٰ شَرِيعَةٍۢ مِّنَ ٱلْأَمْرِ فَٱتَّبِعْهَا وَلَا تَتَّبِعْ أَهْوَآءَ ٱلَّذِينَ لَا يَعْلَمُونَ",
     "en": "Then We put you, [O Muhammad], on an ordained way concerning the matter [of religion]; so follow it and do not follow the inclinations of those who do not know.",
     "ref": "45:18"
    },
    {
     "ar": "وَإِن تُطِعْ أَكْثَرَ مَن فِى ٱلْأَرْضِ يُضِلُّوكَ عَن سَبِيلِ ٱللَّهِ ۚ إِن يَتَّبِعُونَ إِلَّا ٱلظَّنَّ وَإِنْ هُمْ إِلَّا يَخْرُصُونَ",
     "en": "And if you obey most of those upon the earth, they will mislead you from the way of Allah. They follow not except assumption, and they are not but falsifying.",
     "ref": "6:116"
    },
    {
     "ar": "وَأَنَّ هَٰذَا صِرَٰطِى مُسْتَقِيمًۭا فَٱتَّبِعُوهُ ۖ وَلَا تَتَّبِعُوا۟ ٱلسُّبُلَ فَتَفَرَّقَ بِكُمْ عَن سَبِيلِهِۦ ۚ ذَٰلِكُمْ وَصَّىٰكُم بِهِۦ لَعَلَّكُمْ تَتَّقُونَ",
     "en": "And, [moreover], this is My path, which is straight, so follow it; and do not follow [other] ways, for you will be separated from His way. This has He instructed you that you may become righteous.",
     "ref": "6:153"
    },
    {
     "ar": "وَلَئِنْ أَتَيْتَ ٱلَّذِينَ أُوتُوا۟ ٱلْكِتَٰبَ بِكُلِّ ءَايَةٍۢ مَّا تَبِعُوا۟ قِبْلَتَكَ ۚ وَمَآ أَنتَ بِتَابِعٍۢ قِبْلَتَهُمْ ۚ وَمَا بَعْضُهُم بِتَابِعٍۢ قِبْلَةَ بَعْضٍۢ ۚ وَلَئِنِ ٱتَّبَعْتَ أَهْوَآءَهُم مِّنۢ بَعْدِ مَا جَآءَكَ مِنَ ٱلْعِلْمِ ۙ إِنَّكَ إِذًۭا لَّمِنَ ٱلظَّٰلِمِينَ",
     "en": "And if you brought to those who were given the Scripture every sign, they would not follow your qiblah. Nor will you be a follower of their qiblah. Nor would they be followers of one another's qiblah. So if you were to follow their desires after what has come to you of knowledge, indeed, you would then be among the wrongdoers.",
     "ref": "2:145"
    },
    {
     "ar": "۞ وَجَٰوَزْنَا بِبَنِىٓ إِسْرَٰٓءِيلَ ٱلْبَحْرَ فَأَتْبَعَهُمْ فِرْعَوْنُ وَجُنُودُهُۥ بَغْيًۭا وَعَدْوًا ۖ حَتَّىٰٓ إِذَآ أَدْرَكَهُ ٱلْغَرَقُ قَالَ ءَامَنتُ أَنَّهُۥ لَآ إِلَٰهَ إِلَّا ٱلَّذِىٓ ءَامَنَتْ بِهِۦ بَنُوٓا۟ إِسْرَٰٓءِيلَ وَأَنَا۠ مِنَ ٱلْمُسْلِمِينَ",
     "en": "And We took the Children of Israel across the sea, and Pharaoh and his soldiers pursued them in tyranny and enmity until, when drowning overtook him, he said, \"I believe that there is no deity except that in whom the Children of Israel believe, and I am of the Muslims.\"",
     "ref": "10:90"
    },
    {
     "ar": "ثُمَّ أَرْسَلْنَا رُسُلَنَا تَتْرَا ۖ كُلَّ مَا جَآءَ أُمَّةًۭ رَّسُولُهَا كَذَّبُوهُ ۚ فَأَتْبَعْنَا بَعْضَهُم بَعْضًۭا وَجَعَلْنَٰهُمْ أَحَادِيثَ ۚ فَبُعْدًۭا لِّقَوْمٍۢ لَّا يُؤْمِنُونَ",
     "en": "Then We sent Our messengers in succession. Every time there came to a nation its messenger, they denied him, so We made them follow one another [to destruction], and We made them narrations. So away with a people who do not believe.",
     "ref": "23:44"
    },
    {
     "ar": "وَقُل لِّلْمُؤْمِنَٰتِ يَغْضُضْنَ مِنْ أَبْصَٰرِهِنَّ وَيَحْفَظْنَ فُرُوجَهُنَّ وَلَا يُبْدِينَ زِينَتَهُنَّ إِلَّا مَا ظَهَرَ مِنْهَا ۖ وَلْيَضْرِبْنَ بِخُمُرِهِنَّ عَلَىٰ جُيُوبِهِنَّ ۖ وَلَا يُبْدِينَ زِينَتَهُنَّ إِلَّا لِبُعُولَتِهِنَّ أَوْ ءَابَآئِهِنَّ أَوْ ءَابَآءِ بُعُولَتِهِنَّ أَوْ أَبْنَآئِهِنَّ أَوْ أَبْنَآءِ بُعُولَتِهِنَّ أَوْ إِخْوَٰنِهِنَّ أَوْ بَنِىٓ إِخْوَٰنِهِنَّ أَوْ بَنِىٓ أَخَوَٰتِهِنَّ أَوْ نِسَآئِهِنَّ أَوْ مَا مَلَكَتْ أَيْمَٰنُهُنَّ أَوِ ٱلتَّٰبِعِينَ غَيْرِ أُو۟لِى ٱلْإِرْبَةِ مِنَ ٱلرِّجَالِ أَوِ ٱلطِّفْلِ ٱلَّذِينَ لَمْ يَظْهَرُوا۟ عَلَىٰ عَوْرَٰتِ ٱلنِّسَآءِ ۖ وَلَا يَضْرِبْنَ بِأَرْجُلِهِنَّ لِيُعْلَمَ مَا يُخْفِينَ مِن زِينَتِهِنَّ ۚ وَتُوبُوٓا۟ إِلَى ٱللَّهِ جَمِيعًا أَيُّهَ ٱلْمُؤْمِنُونَ لَعَلَّكُمْ تُفْلِحُونَ",
     "en": "And tell the believing women to reduce [some] of their vision and guard their private parts and not expose their adornment except that which [necessarily] appears thereof and to wrap [a portion of] their headcovers over their chests and not expose their adornment except to their husbands, their fathers, their husbands' fathers, their sons, their husbands' sons, their brothers, their brothers' sons, their sisters' sons, their women, that which their right hands possess, or those male attendants having no physical desire, or children who are not yet aware of the private aspects of women. And let them not stamp their feet to make known what they conceal of their adornment. And turn to Allah in repentance, all of you, O believers, that you might succeed.",
     "ref": "24:31"
    },
    {
     "ar": "وَقَوْلِهِمْ إِنَّا قَتَلْنَا ٱلْمَسِيحَ عِيسَى ٱبْنَ مَرْيَمَ رَسُولَ ٱللَّهِ وَمَا قَتَلُوهُ وَمَا صَلَبُوهُ وَلَٰكِن شُبِّهَ لَهُمْ ۚ وَإِنَّ ٱلَّذِينَ ٱخْتَلَفُوا۟ فِيهِ لَفِى شَكٍّۢ مِّنْهُ ۚ مَا لَهُم بِهِۦ مِنْ عِلْمٍ إِلَّا ٱتِّبَاعَ ٱلظَّنِّ ۚ وَمَا قَتَلُوهُ يَقِينًۢا",
     "en": "And [for] their saying, \"Indeed, we have killed the Messiah, Jesus, the son of Mary, the messenger of Allah.\" And they did not kill him, nor did they crucify him; but [another] was made to resemble him to them. And indeed, those who differ over it are in doubt about it. They have no knowledge of it except the following of assumption. And they did not kill him, for certain.",
     "ref": "4:157"
    },
    {
     "ar": "وَمَا كَانَ لِمُؤْمِنٍ أَن يَقْتُلَ مُؤْمِنًا إِلَّا خَطَـًۭٔا ۚ وَمَن قَتَلَ مُؤْمِنًا خَطَـًۭٔا فَتَحْرِيرُ رَقَبَةٍۢ مُّؤْمِنَةٍۢ وَدِيَةٌۭ مُّسَلَّمَةٌ إِلَىٰٓ أَهْلِهِۦٓ إِلَّآ أَن يَصَّدَّقُوا۟ ۚ فَإِن كَانَ مِن قَوْمٍ عَدُوٍّۢ لَّكُمْ وَهُوَ مُؤْمِنٌۭ فَتَحْرِيرُ رَقَبَةٍۢ مُّؤْمِنَةٍۢ ۖ وَإِن كَانَ مِن قَوْمٍۭ بَيْنَكُمْ وَبَيْنَهُم مِّيثَٰقٌۭ فَدِيَةٌۭ مُّسَلَّمَةٌ إِلَىٰٓ أَهْلِهِۦ وَتَحْرِيرُ رَقَبَةٍۢ مُّؤْمِنَةٍۢ ۖ فَمَن لَّمْ يَجِدْ فَصِيَامُ شَهْرَيْنِ مُتَتَابِعَيْنِ تَوْبَةًۭ مِّنَ ٱللَّهِ ۗ وَكَانَ ٱللَّهُ عَلِيمًا حَكِيمًۭا",
     "en": "And never is it for a believer to kill a believer except by mistake. And whoever kills a believer by mistake - then the freeing of a believing slave and a compensation payment presented to the deceased's family [is required] unless they give [up their right as] charity. But if the deceased was from a people at war with you and he was a believer - then [only] the freeing of a believing slave; and if he was from a people with whom you have a treaty - then a compensation payment presented to his family and the freeing of a believing slave. And whoever does not find [one or cannot afford to buy one] - then [instead], a fast for two months consecutively, [seeking] acceptance of repentance from Allah. And Allah is ever Knowing and Wise.",
     "ref": "4:92"
    },
    {
     "ar": "فَإِن لَّمْ يَسْتَجِيبُوا۟ لَكَ فَٱعْلَمْ أَنَّمَا يَتَّبِعُونَ أَهْوَآءَهُمْ ۚ وَمَنْ أَضَلُّ مِمَّنِ ٱتَّبَعَ هَوَىٰهُ بِغَيْرِ هُدًۭى مِّنَ ٱللَّهِ ۚ إِنَّ ٱللَّهَ لَا يَهْدِى ٱلْقَوْمَ ٱلظَّٰلِمِينَ",
     "en": "But if they do not respond to you - then know that they only follow their [own] desires. And who is more astray than one who follows his desire without guidance from Allah? Indeed, Allah does not guide the wrongdoing people.",
     "ref": "28:50"
    },
    {
     "ar": "۞ وَأَوْحَيْنَآ إِلَىٰ مُوسَىٰٓ أَنْ أَسْرِ بِعِبَادِىٓ إِنَّكُم مُّتَّبَعُونَ",
     "en": "And We inspired to Moses, \"Travel by night with My servants; indeed, you will be pursued.\"",
     "ref": "26:52"
    },
    {
     "ar": "أَمْ أَمِنتُمْ أَن يُعِيدَكُمْ فِيهِ تَارَةً أُخْرَىٰ فَيُرْسِلَ عَلَيْكُمْ قَاصِفًۭا مِّنَ ٱلرِّيحِ فَيُغْرِقَكُم بِمَا كَفَرْتُمْ ۙ ثُمَّ لَا تَجِدُوا۟ لَكُمْ عَلَيْنَا بِهِۦ تَبِيعًۭا",
     "en": "Or do you feel secure that He will not send you back into the sea another time and send upon you a hurricane of wind and drown you for what you denied? Then you would not find for yourselves against Us an avenger.",
     "ref": "17:69"
    }
   ],
   "forms": [
    "اِتَّبَعَ"
   ],
   "sense": 1
  },
  {
   "examples": [
    {
     "ar": "أَهُمْ خَيْرٌ أَمْ قَوْمُ تُبَّعٍۢ وَٱلَّذِينَ مِن قَبْلِهِمْ ۚ أَهْلَكْنَٰهُمْ ۖ إِنَّهُمْ كَانُوا۟ مُجْرِمِينَ",
     "en": "Are they better or the people of Tubba' and those before them? We destroyed them, [for] indeed, they were criminals.",
     "ref": "44:37"
    }
   ],
   "forms": [
    "تُبَّع"
   ],
   "sense": 2
  }
 ]
}